{
  "id": "770672122",
  "title": "Toy Story 3",
  "year": 2010,
  "mpaa_rating": "G",
  "runtime": "103",
  "critics_consensus": "Toy Story 3 is a funny, poignant adventure that perfectly balances the franchise's signature humor with an emotional narrative that will resonate with fans young and old.",
  "release_dates": {
    "theater": "2010-06-18",
    "dvd": "2010-11-02"
  },
  "ratings": {
    "critics_rating": "Certified Fresh",
    "critics_score": 98,
    "audience_rating": "Upright",
    "audience_score": 89
  },
  "synopsis": "Woody, Buzz, and the whole gang are back. As their owner Andy prepares to depart for college, his loyal toys find themselves in daycare where untamed tots with ruthless. playtime habits await.",
  "posters": {
    "thumbnail": "http://content8.flixster.com/movie/11/17/11/11171138_mob.jpg",
    "profile": "http://content8.flixster.com/movie/11/17/11/11171138_pro.jpg",
    "detailed": "http://content8.flixster.com/movie/11/17/11/11171138_det.jpg",
    "original": "http://content8.flixster.com/movie/11/17/11/11171138_ori.jpg"
  },
  "abridged_cast": [
    {
      "name": "Tom Hanks",
      "id": "162654148",
      "characters": ["Woody"]
    },
    {
      "name": "Tim Allen",
      "id": "306092258",
      "characters": ["Buzz Lightyear"]
    },
    {
      "name": "Joan Cusack",
      "id": "594123926",
      "characters": ["Jessie the Cowgirl"]
    }
  ],
  "alternate_ids": {
    "imdb": "0435761"
  },
  "links": {
    "self": "http://api.rottentomatoes.com/api/public/v1.0/movies/770672122.json",
    "alternate": "http://www.rottentomatoes.com/m/toy_story_3/",
    "cast": "http://api.rottentomatoes.com/api/public/v1.0/movies/770672122/cast.json",
    "clips": "http://api.rottentomatoes.com/api/public/v1.0/movies/770672122/clips.json",
    "reviews": "http://api.rottentomatoes.com/api/public/v1.0/movies/770672122/reviews.json",
    "similar": "http://api.rottentomatoes.com/api/public/v1.0/movies/770672122/similar.json"
  }
}
